python,BAN-B101,Assert statement used outside of tests,warning,minor,security,"Usage of `assert` statement in application logic is discouraged. `assert` is removed with compiling to optimised byte code (`python -o` producing *.pyo files).Consider raising an exception instead. Ideally, `assert` statement should be used only in tests."
python,BAN-B102,Use of `exec` statement found,warning,major,security,"Usage of `exec` function is strongly discouraged, since it opens up possibilities of unauthorized code execution if the staments are not escaped properly."
python,BAN-B103,Insecure permissions set on a file,warning,minor,security,A particularly permissive control flag was used with `chmod`.
python,BAN-B104,Binding to all interfaces detected with hardcoded values,warning,major,security,"Binding to all network interfaces can potentially open up a service to traffic on unintended interfaces, that may not be properly documented or secured. "
python,BAN-B105,Potential hardcoded password detected,warning,major,security,Potential hardcoded password. Sensitive information like password shouldn't be hardcoded. Use an environment variable instead.
python,BAN-B106,Potential hardcoded password detected as function argument,warning,major,security,Potential hardcoded password as function argument. Sensitive information like password shouldn't be hardcoded in a function argument. Pick it from an environment variable instead.
python,BAN-B107,Potential hardcoded password detected as default function argument,warning,major,security,"Potential hardcoded password as default function argument. Sensitive information like password shouldn't be hardcoded in a function argument. Pick it from an environment variable instead.
"
python,BAN-B108,hardcoded_tmp_directory,warning,minor,security,"Hardcoded temp directory. Prefer using `tmpfile` - https://docs.python.org/3.7/library/tempfile.html

Reason:
Malicious users that can predict the file name and write to directory containing the temporary file can effectively hijack the temporary file by creating a symlink with the name of the temporary file before the program creates the file itself. This allows a malicious user to supply malicious data or cause actions by the program to affect attacker chosen files.
"
python,BAN-B110,try_except_pass,warning,minor,security,"Catching generic exceptions and silently ignoring them is considered bad practice in general, but also presents a potential security issue. A larger than normal volume of errors from a service can indicate an attempt is being made to disrupt or interfere with it. Thus errors should, at the very least, be logged."
python,BAN-B112,try_except_continue,warning,minor,security,"Catching generic exceptions and silently ignoring them in a loop is considered bad practice in general, but also presents a potential security issue. A larger than normal volume of errors from a service can indicate an attempt is being made to disrupt or interfere with it. Thus errors should, at the very least, be logged."
python,BAN-B201,flask_debug_true,warning,critical,security,Running Flask applications in debug mode results in the Werkzeug debugger being enabled. This includes a feature that allows arbitrary code execution. Documentation for both Flask and Werkzeug strongly suggests that debug mode should never be enabled on production systems.
python,BAN-B301,pickle,warning,major,security,"Pickle and modules that wrap it can be unsafe when used to deserialize untrusted data, possible security issue."
python,BAN-B302,marshal,warning,major,security,Deserialization with the marshal module is possibly dangerous.
python,BAN-B303,md5,warning,minor,security,"Use of insecure MD2, MD4, MD5, or SHA1 hash functions should be avoided. Using more secure algorithms like SHA256 or SHA512."
python,BAN-B304,ciphers,warning,major,security,Use of insecure cipher or cipher mode. Replace with a known secure cipher such as AES.
python,BAN-B305,cipher_modes,warning,major,security,Use of insecure cipher or cipher mode. Replace with a known secure cipher such as AES.
python,BAN-B306,mktemp_q,warning,major,security,Use of insecure and deprecated function (mktemp).
python,BAN-B307,eval,warning,major,security,Use of possibly insecure function - consider using safer `ast.literal_eval`.
python,BAN-B308,mark_safe,warning,major,security,Use of `mark_safe()` may expose cross-site scripting vulnerabilities and should be reviewed.
python,BAN-B309,httpsconnection,warning,major,security,Use of `HTTPSConnection` on older versions of Python prior to 2.7.9 and 3.4.3 do not provide security. Please see [this report](https://wiki.openstack.org/wiki/OSSN/OSSN-0033) for details.
python,BAN-B310,urllib_urlopen,warning,major,security,Audit url open for permitted schemes. Allowing use of ‘file:’’ or custom schemes is often unexpected.
python,BAN-B311,random,warning,minor,security,Standard pseudo-random generators are not suitable for security/cryptographic purposes.
python,BAN-B312,telnetlib,warning,major,security,Telnet-related functions are being called. Telnet is considered insecure. Use SSH or some other encrypted protocol.
python,BAN-B313,xml_bad_cElementTree,warning,major,security,Using various XML methods to parse untrusted XML data is known to be vulnerable to XML attacks. Using the [defusedxml](https://pypi.org/project/defusedxml) module is recommended. Methods should be replaced with their `defusedxml` equivalents.
python,BAN-B314,xml_bad_ElementTree,warning,major,security,Using various XML methods to parse untrusted XML data is known to be vulnerable to XML attacks. Using the [defusedxml](https://pypi.org/project/defusedxml) module is recommended. Methods should be replaced with their `defusedxml` equivalents.
python,BAN-B315,xml_bad_expatreader,warning,major,security,Using various XML methods to parse untrusted XML data is known to be vulnerable to XML attacks. Using the [defusedxml](https://pypi.org/project/defusedxml) module is recommended. Methods should be replaced with their `defusedxml` equivalents.
python,BAN-B316,xml_bad_expatbuilder,warning,major,security,Using various XML methods to parse untrusted XML data is known to be vulnerable to XML attacks. Using the [defusedxml](https://pypi.org/project/defusedxml) module is recommended. Methods should be replaced with their `defusedxml` equivalents.
python,BAN-B317,xml_bad_sax,warning,major,security,Using various XML methods to parse untrusted XML data is known to be vulnerable to XML attacks. Using the [defusedxml](https://pypi.org/project/defusedxml) module is recommended. Methods should be replaced with their `defusedxml` equivalents.
python,BAN-B318,xml_bad_minidom,warning,major,security,Using various XML methods to parse untrusted XML data is known to be vulnerable to XML attacks. Using the [defusedxml](https://pypi.org/project/defusedxml) module is recommended. Methods should be replaced with their `defusedxml` equivalents.
python,BAN-B319,xml_bad_pulldom,warning,major,security,Using various XML methods to parse untrusted XML data is known to be vulnerable to XML attacks. Using the [defusedxml](https://pypi.org/project/defusedxml) module is recommended. Methods should be replaced with their `defusedxml` equivalents.
python,BAN-B320,xml_bad_etree,warning,major,security,Using various XML methods to parse untrusted XML data is known to be vulnerable to XML attacks. Using the [defusedxml](https://pypi.org/project/defusedxml) module is recommended. Methods should be replaced with their `defusedxml` equivalents.
python,BAN-B321,ftplib,warning,major,security,FTP-related functions are being called. FTP is considered insecure. Use SSH/SFTP/SCP or some other encrypted protocol.
python,BAN-B322,input,warning,major,security,"The input method in Python 2 will read from standard input, evaluate and run the resulting string as python source code. This is similar, though in many ways worse, then using `eval`. On Python 2, use `raw_input` instead, `input` is safe in Python 3."
python,BAN-B323,unverified_context,warning,major,security,"By default, Python will create a secure, verified ssl context for use in such classes as `HTTPSConnection`. However, it still allows using an insecure context via the `_create_unverified_context` that reverts to the previous behavior that does not validate certificates or perform hostname checks."
python,BAN-B324,hashlib_new_insecure_functions,warning,major,security,"Use of insecure MD2, MD4, MD5, or SHA1 hash functions should be avoided. Using more secure algorithms like SHA256 or SHA512."
python,BAN-B325,tempnam,warning,major,security,Use of `os.tempnam()` and `os.tmpnam()` is vulnerable to symlink attacks. Consider using `tmpfile()` instead.
python,BAN-B401,import_telnetlib,warning,major,security,A telnet-related module is being imported. Telnet is considered insecure. Use SSH or some other encrypted protocol.
python,BAN-B402,import_ftplib,warning,major,security,A FTP-related module is being imported. FTP is considered insecure. Use SSH/SFTP/SCP or some other encrypted protocol.
python,BAN-B403,import_pickle,warning,minor,security,"Consider possible security implications associated with these modules: `pickle`, `cPickle`, `dill`."
python,BAN-B404,import_subprocess,warning,minor,security,Consider possible security implications associated with the `subprocess` module.
python,BAN-B405,import_xml_etree,warning,minor,security,"Using various methods to parse untrusted XML data is known to be vulnerable to XML attacks. Replace vulnerable imports with the equivalent [defusedxml](https://pypi.org/project/defusedxml) package, or make sure `defusedxml.defuse_stdlib()` is called."
python,BAN-B406,import_xml_sax,warning,minor,security,"Using various methods to parse untrusted XML data is known to be vulnerable to XML attacks. Replace vulnerable imports with the equivalent [defusedxml](https://pypi.org/project/defusedxml) package, or make sure `defusedxml.defuse_stdlib()` is called."
python,BAN-B407,import_xml_expat,warning,minor,security,"Using various methods to parse untrusted XML data is known to be vulnerable to XML attacks. Replace vulnerable imports with the equivalent [defusedxml](https://pypi.org/project/defusedxml) package, or make sure `defusedxml.defuse_stdlib()` is called."
python,BAN-B408,import_xml_minidom,warning,minor,security,"Using various methods to parse untrusted XML data is known to be vulnerable to XML attacks. Replace vulnerable imports with the equivalent [defusedxml](https://pypi.org/project/defusedxml) package, or make sure `defusedxml.defuse_stdlib()` is called."
python,BAN-B409,import_xml_pulldom,warning,minor,security,"Using various methods to parse untrusted XML data is known to be vulnerable to XML attacks. Replace vulnerable imports with the equivalent [defusedxml](https://pypi.org/project/defusedxml) package, or make sure `defusedxml.defuse_stdlib()` is called."
python,BAN-B410,import_lxml,warning,minor,security,Using various methods to parse untrusted XML data is known to be vulnerable to XML attacks. Replace vulnerable imports with the equivalent [defusedxml](https://pypi.org/project/defusedxml) package.
python,BAN-B411,import_xmlrpclib,warning,major,security,XMLRPC is particularly dangerous as it is also concerned with communicating data over a network. Use `defused.xmlrpc.monkey_patch()` function to monkey-patch xmlrpclib and mitigate remote XML attacks.
python,BAN-B412,import_httpoxy,warning,major,security,"httpoxy is a set of vulnerabilities that affect application code running in CGI, or CGI-like environments. The use of CGI for web applications should be avoided to prevent this class of attack. More details are available at [httpoxy.org](https://httpoxy.org/)."
python,BAN-B413,import_pycrypto,warning,major,security,pycrypto library is known to have publicly disclosed [buffer overflow vulnerability](https://github.com/dlitz/pycrypto/issues/176). It is no longer actively maintained and has been deprecated in favor of pyca/cryptography library.
python,BAN-B414,import_pycryptodome,warning,major,security,"pycryptodome is a direct fork of pycrypto that has not fully addressed the issues inherent in PyCrypto. It seems to exist, mainly, as an API compatible continuation of pycrypto and should be deprecated in favor of pyca/cryptography which has more support among the Python community."
python,BAN-B501,request_with_no_cert_validation,warning,major,security,Encryption in general is typically critical to the security of many applications. Using TLS can greatly increase security by guaranteeing the identity of the party you are communicating with. This is accomplished by one or both parties presenting trusted certificates during the connection initialization phase of TLS.
python,BAN-B502,ssl_with_bad_version,warning,major,security,"Several highly publicized exploitable flaws have been discovered in all versions of SSL and early versions of TLS. It is strongly recommended that use of the following known broken protocol versions be avoided:

 - SSL v2
 - SSL v3
 - TLS v1
 - TLS v1.1"
python,BAN-B503,ssl_with_bad_defaults,warning,minor,security,"Several highly publicized exploitable flaws have been discovered in all versions of SSL and early versions of TLS. It is strongly recommended that use of the following known broken protocol versions be avoided:

 - SSL v2
 - SSL v3
 - TLS v1
 - TLS v1.1"
python,BAN-B504,ssl_with_no_version,warning,minor,security,"Several highly publicized exploitable flaws have been discovered in all versions of SSL and early versions of TLS. It is strongly recommended that use of the following known broken protocol versions be avoided:

 - SSL v2
 - SSL v3
 - TLS v1
 - TLS v1.1"
python,BAN-B505,weak_cryptographic_key,warning,major,security,"As computational power increases, so does the ability to break ciphers with smaller key lengths. The recommended key length size for RSA and DSA algorithms is 2048 and higher. 1024 bits and below are now considered breakable. EC key length sizes are recommended to be 224 and higher with 160 and below considered breakable."
python,BAN-B506,yaml_load,warning,minor,security,"The yaml.load function provides the ability to construct an arbitrary Python object, which may be dangerous if you receive a YAML document from an untrusted source. The function `yaml.safe_load` limits this ability to simple Python objects like integers or lists."
python,BAN-B507,ssh_no_host_key_verification,warning,major,security,"Encryption in general is typically critical to the security of many applications. Using SSH can greatly increase security by guaranteeing the identity of the party you are communicating with. This is accomplished by one or both parties presenting trusted host keys during the connection initialization phase of SSH.

When paramiko methods are used, host keys are verified by default."
python,BAN-B601,paramiko_calls,warning,major,security,Paramiko is a Python library designed to work with the SSH2 protocol for secure (encrypted and authenticated) connections to remote machines. It is intended to run commands on a remote host. These commands are run within a shell on the target and are thus vulnerable to various shell injection attacks. Use of Paramiko’s “exec_command” or “invoke_shell” methods should be reviewed to ensure that the input is sanitized.
python,BAN-B602,subprocess_popen_with_shell_equals_true,warning,major,security,"Python possesses many mechanisms to invoke an external executable. However, doing so may present a security issue if appropriate care is not taken to sanitize any user provided or variable input. Subprocess invocation using a command shell is dangerous as it is vulnerable to various shell injection attacks. Great care should be taken to sanitize all input in order to mitigate this risk. Calls of this type are identified by a parameter of ‘shell=True’ being given."
python,BAN-B603,subprocess_without_shell_equals_true,warning,minor,security,"Spawning of a subprocess without the use of a command shell is not vulnerable to shell injection attacks, but care should still be taken to ensure validity of input."
python,BAN-B604,any_other_function_with_shell_equals_true,warning,major,security,Method calls for the presence of a keyword parameter shell equalling true can be vulnerable to shell injection issues. This issue is intended to catch custom wrappers to vulnerable methods that may have been created.
python,BAN-B605,start_process_with_a_shell,warning,minor,security,Spawning of a subprocess using a command shell is dangerous as it is vulnerable to various shell injection attacks. Great care should be taken to sanitize all input in order to mitigate this risk. Calls of this type are identified by the use of certain commands which are known to use shells. 
python,BAN-B606,start_process_with_no_shell,warning,minor,security,"Spawning of a subprocess in a way that doesn’t use a shell is generally safe, but it maybe useful for penetration testing workflows to track where external system calls are used."
python,BAN-B607,start_process_with_partial_path,warning,minor,security,Python possesses many mechanisms to invoke an external executable. If the desired executable path is not fully qualified relative to the filesystem root then this may present a potential security risk.
python,BAN-B608,hardcoded_sql_expressions,warning,major,security,"An SQL injection attack consists of insertion or “injection” of a SQL query via the input data given to an application. It is a very common attack vector. Unless care is taken to sanitize and control the input data when building such SQL statement strings, an injection attack becomes possible."
python,BAN-B609,linux_commands_wildcard_injection,warning,major,security,The use of partially qualified paths may result in unintended consequences if an unexpected file or symlink is placed into the path location given. This becomes particularly dangerous when combined with commands used to manipulate file permissions or copy data off of a system.
python,BAN-B610,django_extra_used,warning,minor,security,"Use of `extra` in Django querysets should be audited, since unsanitized strings can open up security vulnerabilities."
python,BAN-B611,django_rawsql_used,warning,minor,security,"Use of `extra` in Django querysets should be audited, since unsanitized strings can open up security vulnerabilities."
python,BAN-B701,jinja2_autoescape_false,warning,critical,security,"When autoescaping is enabled, Jinja2 will filter input strings to escape any HTML content submitted via template variables. Without escaping HTML input the application becomes vulnerable to Cross Site Scripting (XSS) attacks."
python,BAN-B702,use_of_mako_templates,warning,major,security,"Unlike Jinja2 (an alternative templating system), Mako has no environment wide variable escaping mechanism. Because of this, all input variables must be carefully escaped before use to prevent possible vulnerabilities to Cross Site Scripting (XSS) attacks."
python,BAN-B703,django_mark_safe,warning,minor,security,Use of `mark_safe()` may expose cross-site scripting vulnerabilities and should be reviewed.
python,FLK8-C901,Function is too complex,warning,major,bug-risk,"Too many decision blocks were found, which is why the code has been tagged as complex. You should consider refactoring the code for simplicity. Read more about cyclomatic complexity [here](https://en.wikipedia.org/wiki/Cyclomatic_complexity)."
python,FLK8-D100,Missing docstring in public module,info,minor,doc,
python,FLK8-D101,Missing docstring in public class,info,minor,doc,
python,FLK8-D102,Missing docstring in public method,info,minor,doc,
python,FLK8-D103,Missing docstring in public function,info,minor,doc,It is recommended to have docstrings in public functions.
python,FLK8-D104,Missing docstring in public package,info,minor,doc,
python,FLK8-D105,Missing docstring in magic method,info,minor,doc,
python,FLK8-D106,Missing docstring in public nested class,info,minor,doc,
python,FLK8-D107,Missing docstring in `__init__`,info,minor,doc,It is recommended to have docstrings in the `__init__` method.
python,FLK8-D200,One-line docstring should fit on one line with quotes,info,minor,doc,
python,FLK8-D201,No blank lines allowed before function docstring,info,minor,doc,
python,FLK8-D202,No blank lines allowed after function docstring,info,minor,doc,
python,FLK8-D203,1 blank line required before class docstring,info,minor,doc,
python,FLK8-D204,1 blank line required after class docstring,info,minor,doc,
python,FLK8-D205,1 blank line required between summary line and description,info,minor,doc,
python,FLK8-D206,"Docstring should be indented with spaces, not tabs",info,minor,doc,"It is recommended to use spaces in the docstrings, just as the code."
python,FLK8-D207,Docstring is under-indented,info,minor,doc,It is recommended to properly indent docstrings for readability. 
python,FLK8-D208,Docstring is over-indented,info,minor,doc,It is recommended to properly indent docstrings for readability. 
python,FLK8-D209,Multi-line docstring closing quotes should be on a separate line,info,minor,doc,
python,FLK8-D210,No whitespaces allowed surrounding docstring text,info,minor,doc,
python,FLK8-D211,No blank lines allowed before class docstring,info,minor,doc,
python,FLK8-D212,Multi-line docstring summary should start at the first line,info,minor,doc,
python,FLK8-D213,Multi-line docstring summary should start at the second line,info,minor,doc,
python,FLK8-D214,Section is over-indented,info,minor,doc,
python,FLK8-D215,Section underline is over-indented,info,minor,doc,
python,FLK8-D300,Use “”“triple double quotes”“”,info,minor,doc,Use of triple-quotes is recommended to specify docstrings.
python,FLK8-D301,Use r”“” if any backslashes in a docstring,info,minor,doc,"If there are backslashes in a docstring, please raw strings."
python,FLK8-D302,Use u”“” for Unicode docstrings,info,minor,doc,
python,FLK8-D400,First line should end with a period,info,minor,doc,
python,FLK8-D401,First line should be in imperative mood,info,minor,doc,
python,FLK8-D401,First line should be in imperative mood; try rephrasing,info,minor,doc,
python,FLK8-D402,First line should not be the function’s “signature”,info,minor,doc,
python,FLK8-D403,First word of the first line should be properly capitalized,info,minor,doc,
python,FLK8-D404,First word of the docstring should not be This,info,minor,doc,
python,FLK8-D405,Section name should be properly capitalized,info,minor,doc,
python,FLK8-D406,Section name should end with a newline,info,minor,doc,
python,FLK8-D407,Missing dashed underline after section,info,minor,doc,
python,FLK8-D408,Section underline should be in the line following the section’s name,info,minor,doc,
python,FLK8-D409,Section underline should match the length of its name,info,minor,doc,
python,FLK8-D410,Missing blank line after section,info,minor,doc,
python,FLK8-D411,Missing blank line before section,info,minor,doc,
python,FLK8-D412,No blank lines allowed between a section header and its content,info,minor,doc,
python,FLK8-D413,Missing blank line after last section,info,minor,doc,
python,FLK8-D414,Section has no content,info,minor,doc,
python,FLK8-E101,Indentation contains mixed spaces and tabs,warning,major,bug-risk,"Indentation has has both tabs and spaces in it. You should use either tabs or spaces, but not both."
python,FLK8-E111,Indentation is not a multiple of four,warning,major,style,PEP8 recommends that Python code indentation be a multiple of four.
python,FLK8-E112,Expected an indented block,warning,major,bug-risk,This issue occurs when code is not indented but should be.
python,FLK8-E113,Unexpected indentation,error,major,bug-risk,A line is indented when it shouldn’t be. Usually this will mean that multiple lines need to be indented at the same level.
python,FLK8-E114,Indentation is not a multiple of four in comments,info,minor,style,Comment indentation should be a multiple of four.
python,FLK8-E115,Expected an indented block in comments,info,minor,style,An indented block comment was expected but a non-indented block comment was found instead.
python,FLK8-E116,Unexpected indentation in comments,info,minor,style,Comments should be indented relative to the code in the block they are in.
python,FLK8-E121,Continuation line under-indented for hanging indent,info,minor,style,A line is less indented than it should be for hanging indents.
python,FLK8-E122,Continuation line missing indentation or outdented,info,minor,style,A continuation line is not indented as far as it should be or is indented too far.
python,FLK8-E123,Closing bracket does not match indentation of opening bracket's line,info,minor,style,Closing brackets should match the same indentation level of the line that their opening bracket started on.
python,FLK8-E124,Closing bracket does not match visual indentation,info,minor,style,Closing brackets should match the indentation of the opening bracket.
python,FLK8-E125,Continuation line with same indent as next logical line,info,minor,style,"Continuation lines should not be indented at the same level as the next logical line. Instead, they should be indented to one more level so as to distinguish them from the next line."
python,FLK8-E126,Continuation line over-indented for hanging indent,info,minor,style,A continuation line is indented farther than it should be for a hanging indent.
python,FLK8-E127,Continuation line over-indented for visual indent,info,minor,style,A continuation line is indented farther than it should be for a visual indent.
python,FLK8-E128,Continuation line under-indented for visual indent,info,minor,style,A continuation line is under-indented for a visual indentation.
