python,FLK8-E129,Visually indented line with same indent as next logical line,info,minor,style,A visual indented line has the same indentation as the next logical line. This can make it hard to read.
python,FLK8-E131,Continuation line unaligned for hanging indent,info,minor,style,A continuation line is unaligned for hanging indent.
python,FLK8-E201,Whitespace after `(`,info,minor,style,Open parentheses should not have any space before or after them.
python,FLK8-E202,Whitespace before `)`,info,minor,style,Closing parentheses should not have any before after them.
python,FLK8-E203,Whitespace before `:`,info,minor,style,Colons should not have any space before them.
python,FLK8-E211,Whitespace before `(`,info,minor,style,Open parentheses should not have any space before or after them.
python,FLK8-E221,Multiple spaces found before operator,info,minor,style,There should be only one space before an operator.
python,FLK8-E222,Multiple spaces found after operator,info,minor,style,There should be only one space after an operator.
python,FLK8-E223,Tab found before operator,info,minor,style,There should be only one space before or after operators.
python,FLK8-E224,Tab found after operator,info,minor,style,There should be only one space before or after operators.
python,FLK8-E225,Missing whitespace around operator,info,minor,style,There should be one space before and after all operators.
python,FLK8-E226,Missing whitespace around arithmetic operator,info,minor,style,"There should be one space before and after an arithmetic operator (`+`, `-`, `/`, and `*`)."
python,FLK8-E227,Missing whitespace around bitwise or shift operator,info,minor,style,"There should be one space before and after bitwise and shift operators (`<<`, `>>`, `&`, `|`, `^`)."
python,FLK8-E228,Missing whitespace around modulo operator,info,minor,style,The modulo operator (`%`) should have whitespace on either side of it.
python,FLK8-E231,"Missing whitespace after ',', ';', or ':'",info,minor,style,"There should be whitespace after the characters `,`, `;`, and `:`."
python,FLK8-E241,"Multiple spaces after ','",info,minor,style,"There should be only one space after the `,` character."
python,FLK8-E242,"Tab after ','",info,minor,style,"There should be only one space after the `,` character."
python,FLK8-E251,Unexpected spaces around keyword / parameter equals,info,minor,style,There should be no spaces before or after the `=` in a function definition.
python,FLK8-E261,At least two spaces before inline comment,info,minor,style,"Inline comments should have two spaces before them. Often programmers will only include one space, which will trigger this warning."
python,FLK8-E262,Inline comment should start with `# `,info,minor,style,Inline comments should have one space before the pound sign (`#`) and the comment itself.
python,FLK8-E265,Block comment should start with `# `,info,minor,style,Block comments should have one space before the pound sign (`#`) and the comment itself.
python,FLK8-E266,Too many leading `#` for block comment,info,minor,style,There should be only one leading `#` for a block comment.
python,FLK8-E271,Multiple spaces after keyword,info,minor,style,There should be only one space after a keyword.
python,FLK8-E272,Multiple spaces before keyword,info,minor,style,There should be only one space before a keyword.
python,FLK8-E273,Tab after keyword,info,minor,style,There should be only one space after a keyword.
python,FLK8-E274,Tab before keyword,info,minor,style,There should be only one space before a keyword.
python,FLK8-E275,Missing whitespace after keyword,info,minor,style,There should be one space after keywords.
python,FLK8-E301,"Expected 1 blank line, found 0",info,minor,style,One blank line is expected between the methods of a class.
python,FLK8-E302,"Expected 2 blank lines, found 0",info,minor,style,Two blank lines are expected between functions and classes.
python,FLK8-E303,Too many blank lines found,info,minor,style,Two blank lines are expected between functions and classes and one blank line is expected between methods of a class.
python,FLK8-E304,Blank lines found after function decorator,info,minor,style,There should be no blank lines between a function decorator and the function it is decorating.
python,FLK8-E305,Expected 2 blank lines after end of function or class,info,minor,style,"Functions and classes should have two blank lines after them, separating them from other functions and classes.
"
python,FLK8-E306,Expected 1 blank line before a nested definition,info,minor,style,Nested functions and classes should have one blank line before them.
python,FLK8-E401,Multiple imports on one line,info,minor,style,Imports from different modules should occur on different lines.
python,FLK8-E402,Module level import not at top of file,info,minor,style,All module level imports should be at the top of the file. This means that there should be no statements in between module level imports.
python,FLK8-E501,Line too long,info,minor,style,Line lengths are recommended to be no greater than 79 characters.
python,FLK8-E502,The backslash is redundant between brackets,info,minor,style,There is no need for backslashes between brackets.
python,FLK8-E701,Multiple statements on one line (colon),info,major,style,Multiple statements should be on their own separate lines. This improves readability.
python,FLK8-E702,Multiple statements on one line (semicolon),info,minor,style,Multiple statements should not be on the same line separated by a semicolon. They should be on their own separate lines.
python,FLK8-E703,Statement ends with a semicolon,info,minor,style,"Unlike programming languages like Java and C#, statements in Python do not need to end with a semicolon. They can be removed."
python,FLK8-E704,Multiple statements on one line (def),info,major,style,Multiple statements of a function definition should be on their own separate lines.
python,FLK8-E711,Comparison to None should be 'if cond is None:',warning,minor,bug-risk,"Comparisons to the singleton objects, like `True`, `False`, and `None`, should be done with identity, not equality. Use “is” or “is not”."
python,FLK8-E712,Comparison to True should be 'if cond is True:' or 'if cond:',warning,minor,bug-risk,"When comparing a variable to `True`, you should use the form `if x is True` or simply `if x`. The most common incorrect form is `if x == True`."
python,FLK8-E713,Test for membership should be 'not in',warning,minor,bug-risk,Tests for membership should use the form `x not in the_list` rather than `not x in the_list`. The former example is simply more readable.
python,FLK8-E714,Test for object identity should be 'is not',warning,minor,bug-risk,Tests for object identity should use the form `x is not None` rather than `not x is None`. The former example is simply more readable.
python,FLK8-E722,"Do not use bare `except`, specify exception instead",warning,minor,bug-risk,Using `except` without a specific exception can be error prone.
python,FLK8-E731,"Do not assign a lambda expression, use a `def`",warning,minor,bug-risk,"Lambdas should not be assigned to a variable. Instead, they should be defined as functions. The primary reason for this is debugging. Lambdas show as `<lambda>` in tracebacks, where functions will display the function’s name."
python,FLK8-E741,"Do not use variables named 'l', 'O', or 'I'",warning,major,style,"Variables named `I`, `O`, and `l` can be very hard to read. This is because the letter `I` and the letter `l` are easily confused, and the letter `O` and the number `0` can be easily confused.

Change the names of these variables to something more descriptive.

"
python,FLK8-E742,"Do not define classes named 'l', 'O', or 'I'",warning,major,style,"Classes named `I`, `O`, and `l` can be very hard to read. This is because the letter `I` and the letter `l` are easily confused, and the letter `O` and the number `0` can be easily confused.

Change the names of these classes to something more descriptive."
python,FLK8-E743,"Do not define functions named 'l', 'O', or 'I'",warning,major,style,"Functions named `I`, `O`, and `l` can be very hard to read. This is because the letter `I` and the letter `l` are easily confused, and the letter `O` and the number `0` can be easily confused.

Change the names of these functions to something more descriptive."
python,FLK8-F402,import module from line N shadowed by loop variable,warning,major,bug-risk,Loop variables should not redefine the name of modules that are imported.
python,FLK8-F403,‘from module import *’ used; unable to detect undefined names,warning,major,bug-risk,"`from module import *` is discouraged because the programmer often won’t know where an imported object is defined. The imported module, class, or function should be explicitly defined."
python,FLK8-F404,future import(s) name after other statements,warning,major,style,Imports from `__future__` should be the first imports in a file.
python,FLK8-F405,"name may be undefined, or defined from star imports: module",warning,major,bug-risk,"This warning occurs in conjunction with issue FLK8-F403, `'from module import *'` used. It means that the variable name could be undefined, but we cannot be sure because it also could also be imported in the star imports.

Confirm that the variable is defined in the star imports. If it is, explicitly import it instead of importing `*`. If not, then define the variable."
python,FLK8-F406,`from module import *` is only allowed at module level,warning,major,bug-risk,"Importing `*` is generally discouraged, but if there's a need regardless, such imports should only be done on module level."
python,FLK8-F407,an undefined __future__ feature name was imported,warning,critical,bug-risk,The imported name does not exist in the `__future__` package.
python,FLK8-F601,Dictionary key name repeated with different values,warning,major,bug-risk,All dictionary keys should be unique.
python,FLK8-F602,Dictionary key variable name repeated with different values,warning,major,bug-risk,All dictionary keys should be unique.
python,FLK8-F621,Too many expressions in an assignment with star-unpacking,warning,major,bug-risk,Too many expressions found in starred assignment. This can be error prone.
python,FLK8-F622,"Two or more starred expressions in an assignment (a, *b, *c = d)",warning,major,bug-risk,There are more than one starred expressions (*x) in an assignment. This is a SyntaxError.
python,FLK8-F631,"Assertion test is a tuple, which are always True",warning,major,bug-risk,"A tuple with at least one element is always truthy, so the assertion will always pass. Remove the parentheses."
python,FLK8-F701,`break` statement used outside of a `while` or `for` loop,warning,major,bug-risk,break statement should not be used outside a loop.
python,FLK8-F702,`continue` statement outside of a `while` or `for` loop,warning,major,bug-risk,continue statement should not be used outside a loop.
python,FLK8-F703,`continue` statement used in a `finally` block in a loop,warning,minor,bug-risk,"continue statement doesn't have any effect in the finally block, and can be removed."
python,FLK8-F704,`yield` or `yield from` statement used outside of a function,warning,major,bug-risk,yield should not be used outside of a function.
python,FLK8-F705,`return` statement used with arguments inside a generator,warning,major,bug-risk,A return statement with arguments should not be used inside a generator.
python,FLK8-F706,`return` statement used outside of a function or method,warning,major,bug-risk,Return statement should not be used outside of a function or method.
python,FLK8-F707,`except:` block found as not the last exception handler,warning,major,bug-risk,A bare exception catcher should always be the last block in a `try...except`.
python,FLK8-F721,doctest syntax error syntax error in forward type annotation,,,,
python,FLK8-F722,doctest syntax error syntax error in forward type annotation,,,,
python,FLK8-F812,List comprehension redefines name from line N,warning,minor,bug-risk,A list comprehension is using the same name as another variable defined in the module. Either change the variable name in the list comprehension or change it in the module.
python,FLK8-F821,Undefined name detected,error,critical,bug-risk,The variable name is not defined where it is used.
python,FLK8-F822,Undefined name detected in `__all__`,error,critical,bug-risk,An undefined module was specified in the `__all__` list. Ensure that it is specified in your file or remove the variable from `__all__`.
python,FLK8-F823,Local variable name referenced before assignment,error,critical,bug-risk,Local variables should be defined before they are referenced.
python,FLK8-F831,Duplicate argument in function definition,error,critical,bug-risk,Two or more parameters in a function definition have the same name. All names in the function definition should be distinct.
python,FLK8-F841,Local variable is assigned to but never used,warning,minor,bug-risk,A local variable in your function was defined but is not being used. This local variable should be removed.
python,FLK8-F901,`raise NotImplemented` should be `raise NotImplementedError`,warning,major,bug-risk,"`NotImplemented` signals to the runtime that it should ask someone else to satisfy the operation. In the expression `a == b`, if `a.__eq__(b)` returns `NotImplemented`, then Python tries `b.__eq__(a)`. If `b` knows enough to return `True` or `False`, then the expression can succeed. If it doesn't, then the runtime will fall back to the built-in behavior (which is based on identity for `==` and `!=`).

Raising an exception would break out of the sort unless caught, whereas `NotImplemented` doesn't get raised and can be used in further tests."
python,FLK8-W191,Indentation contains tabs,info,minor,style,Indentation has tabs when only spaces are expected. Change all tabs to spaces.
python,FLK8-W291,Trailing whitespace,info,minor,style,There should be no whitespace after the final character in a line.
python,FLK8-W292,No newline at end of file,info,minor,style,Files should end with a newline.
python,FLK8-W293,Blank line contains whitespace,info,minor,style,Blank lines should not contain any tabs or spaces.
python,FLK8-W391,Blank line at end of file,info,minor,style,"There should be one, and only one, blank line at the end of each file. This warning will occur when there are two or more blank lines."
python,FLK8-W503,Line break before binary operator,info,minor,style,Line breaks should occur after the binary operator to keep all variable names aligned.
python,FLK8-W504,Line break after binary operator,info,minor,style,
python,FLK8-W505,Doc line too long,info,minor,style,Docstring line lengths are recommended to be no greater than 79 characters.
python,FLK8-W601,".has_key() is deprecated, use 'in'",warning,major,code-smell,`.has_key()` was deprecated in Python 2. It is recommended to use the in operator instead.
python,FLK8-W602,deprecated form of raising exception,warning,major,code-smell,"The `raise Exception, message` form of raising exceptions is deprecated. Use the new form, `raise Exception(message)`."
python,FLK8-W603,"<>' is deprecated, use '!='",warning,major,code-smell,`<>` has been deprecated and removed in Python 3. Replace instances of `<>` with `!=`.
python,FLK8-W604,"backticks are deprecated, use 'repr()'",warning,major,code-smell,Backticks were deprecated and removed in Python 3. Use the built-in function `repr()` instead.
python,FLK8-W605,Invalid escape sequence found,warning,major,bug-risk,"As of Python 3.6, a backslash-character pair that is not a valid escape sequence now generates a DeprecationWarning. Although this will eventually become a SyntaxError, that will not be for several Python releases."
python,FLK8-W606,`async` and `await` are reserved keywords starting with Python 3.7,warning,major,bug-risk,Using these symbols as names can break your code in future.
python,FLK8-E999,SyntaxError: invalid sytax,error,critical,bug-risk,A Python syntax error is detected.
python,PYL-C0102,blacklisted-name,warning,major,style,These names can make the intention of the code unclear and hard to understand and debug. Using descripted names is recommended.
python,PYL-C0113,unneeded-not,warning,major,style,"The boolean expression contains an unneeded negation, and can be re-written without using the `not` statement."
python,PYL-C0122,misplaced-comparison-constant,warning,major,style,The constant is placed on the left side of a comparison. It is usually clearer in intent to place it in the right hand side of the comparison.
python,PYL-C0123,unidiomatic-typecheck,warning,major,bug-risk,"Use `type()` instead of `isinstance()` for a typecheck. The idiomatic way to perform an explicit typecheck in Python is to use `isinstance(x, Y)` rather than `type(x) == Y`, `type(x) is Y`. This is because `isinstance` can handle subclasses as well."
python,PYL-C0200,consider-using-enumerate,warning,major,style,"Consider using enumerate instead of iterating with range and len, which is more straightforward."
python,PYL-C0201,consider-iterating-dictionary,warning,major,style,"Consider iterating the dictionary directly instead of calling .keys(). It is enough to just iterate through the dictionary itself, as in `for key in dictionary`."
python,PYL-C0202,bad-classmethod-argument,warning,major,style,Use of `cls` as the first named argument in a class method is recommended so it's easy to differentiate them from regular instance methods.
python,PYL-C0203,bad-mcs-method-argument,warning,major,style,Use of `cls` as the first named argument in a metaclass method is recommended so it's easy to differentiate them from regular instance methods.
python,PYL-C0204,bad-mcs-classmethod-argument,warning,major,style,Use of `mcs` as the first named argument in a metaclass class method is recommended so it's easy to differentiate them from regular instance methods.
python,PYL-C0205,single-string-used-for-slots,warning,major,style,"Class slots is a simple string, rather than an iterable."
python,PYL-C0302,too-many-lines,warning,minor,code-smell,"Having too many lines in a module reduces readability, and may be a sign that refactoring is needed. The recommended maximum number of lines in a module is 1000."
python,PYL-C0325,superfluous-parens,warning,minor,style,Parentheses can be omitted after the keyword.
python,PYL-C0327,mixed-line-endings,warning,minor,style,There are mixed (LF and CRLF) newline signs in a file.
python,PYL-C0328,unexpected-line-ending-format,warning,minor,style,Unexpected line ending format.
python,PYL-C0401,wrong-spelling-in-comment,info,minor,style,A word in comment is not spelled correctly.
python,PYL-C0402,wrong-spelling-in-docstring,info,minor,style,A word in docstring is not spelled correctly.
python,PYL-C0403,invalid-characters-in-docstring,info,minor,style,Invalid characters found in docstring.
python,PYL-C1801,len-as-condition,warning,major,performance,"Using the `len` function to check if a sequence is empty is not idiomatic and can be less performant than checking for truthness of the sequence. 

`len` doesn't know the context in which it is called, so if computing the length means traversing the entire sequence, it must; it doesn't know that the result is just being compared to 0. Computing the boolean value can stop after it sees the first element, regardless of how long the sequence actually is."
python,PYL-E0100,init-is-generator,error,critical,bug-risk,"The `__init__()` method is required to return nothing, but a `yield` statement in its body was detected. This will raise a `TypeError` on Python 2.7 and 3.x."
python,PYL-E0101,return-in-init,error,critical,bug-risk,"The `__init__()` method is required to return `None`, but an explicit return value in its body was detected. This will raise a `TypeError` on Python 2.7 and 3.x."
python,PYL-E0102,function-redefined,error,major,bug-risk,"A redefinition of functions, classes, and methods is allowed and overrides the original definition in Python, but is confusing and cause bugs that are difficult to debug."
python,PYL-E0110,abstract-class-instantiated,error,major,bug-risk,An abstract class with `abc.ABCMeta` as metaclass has abstract methods and is instantiated.
python,PYL-E0111,bad-reversed-sequence,error,critical,bug-risk,"The first argument to `reversed()` builtin isn't a sequence (does not implement `reversed`, nor `getitem` and `len`)."
python,PYL-E0113,invalid-star-assignment-target,error,major,bug-risk,A star expression is used as a starred assignment target. It must be in a list or tuple.
python,PYL-E0114,star-needs-assignment-target,error,major,bug-risk,A star expression can only be used in an assignment target.
python,PYL-E0115,nonlocal-and-global,error,major,bug-risk,A name is defined as nonlocal and global in the same scope.
python,PYL-E0117,nonlocal-without-binding,error,major,bug-risk,A name is defined as nonlocal without any binding.
python,PYL-E0118,used-prior-global-declaration,error,major,bug-risk,A global name us used prior to it's global declaration.
python,PYL-E0119,misplaced-format-function,error,critical,bug-risk,The `format()` function is called on an object that is not a string. This is an error.
python,PYL-E0202,method-hidden,error,major,bug-risk,"When a method is defined in a child class which has the same name as an attribute in the ancestor class, the attribute in the ancestor class takes precedence and hides the method."
python,PYL-E0203,access-member-before-definition,error,critical,bug-risk,A member of a class is being accessed before its definition. This is an error.
python,PYL-E0211,no-method-argument,error,critical,bug-risk,A method which should have the bound instance as first argument has no argument defined. This is an error.
python,PYL-E0213,no-self-argument,error,critical,bug-risk,"A method has an attribute different the ""self"" as first argument. This is considered as an error since this is a so common convention that you shouldn't break it."
python,PYL-E0236,invalid-slots-object,error,critical,bug-risk,Slots must contain only string objects.
python,PYL-E0237,assigning-non-slot,error,critical,bug-risk,Assigning to an attribute not defined in the class slots will cause an error.
python,PYL-E0238,invalid-slots,error,critical,bug-risk,"An invalid slots value is found in class. Only a string, an iterable or a sequence is permitted. This is an error."
python,PYL-E0239,inherit-non-class,error,critical,bug-risk,Python classes can only inherit from a class. Inheriting from any other object is an error.
python,PYL-E0240,inconsistent-mro,error,critical,bug-risk,"The order in which other classes are specified for inheritence in a class matters. Python classes use the C3 linearization method to determine a method resolution ordering for each class, which ensures that for a class C, if a class C1 precedes a class C2 in the MRO of C then C1 should also precede C2 in the MRO of all subclasses of C."
python,PYL-E0241,duplicate-bases,error,critical,bug-risk,A class must not specify inheritance from another class more than one times. Duplicate base classes will raise a `TypeError`.
python,PYL-E0301,non-iterator-returned,error,critical,bug-risk,The `__iter__` method of a class must return an iterator with a `__next__` method.
python,PYL-E0303,invalid-length-returned,error,critical,bug-risk,The `__len__` method of a class must return a non-negative integer.
python,PYL-E0402,Attempted relative import beyond top-level package,error,critical,bug-risk,A relative import has been attempted from beyond the top-level package. This is an error.
python,PYL-E0604,Invalid object found in `__all__`,error,critical,bug-risk,The `__all__` list must contain only strings. Having other kinds of objects is an error.
python,PYL-E0633,Attempting to unpack a non-sequence object,error,critical,bug-risk,"Unpacking is supported only for sequence objects, like lists, sets, tuples, iterators or generators, etc."
python,PYL-E0701,Bad `except` order found,error,critical,bug-risk,Except clauses are not in the correct order (from the more specific to the more generic). Some exceptions may not be caught by the most specific handler.
python,PYL-E0702,Object of unsupported type raised,error,critical,bug-risk,Only classess or instances are allowed to be raised. Raising other types is an error.
python,PYL-E0703,"Exception context set to something which is not an exception, nor None",error,critical,bug-risk,"The syntax `raise ... from ...` can be used only when the exception context is an exception, or `None`. Trying to do so with other object types is an error."
python,PYL-E0704,The raise statement is not inside an except clause,error,critical,bug-risk,"A bare raise is used inside something which is not an `except` clause. This generates an error, since there are no active exceptions to be re-raised. An exception to this rule is represented by a bare raise inside a `finally` clause, which might work, as long as an exception is raised inside the `try` block, but it is nevertheless a code smell that must not be relied upon."
python,PYL-E0710,New-style class raised which doesn't inherit from `BaseException`,error,critical,bug-risk,New-style classes raised must inherit from `BaseException`.
python,PYL-E0712,Exception caught which does not inherit from `Exception`,error,critical,bug-risk,"For an exception to be caught, it must inherit from the `Exception` class."
python,PYL-E1003,Bad first argument given in `super()` call,error,critical,bug-risk,The first argument to the `super()` function must be the current class.
python,PYL-E1004,Missing argument in `super()` call,error,critical,bug-risk,"In Python 2.x, the `super()` function must be called with the current class as the first argument, and the current instance as the second argument."
